[
  {
    "id": "WILD-001",
    "family": "wild",
    "name": "Free plugs on a side",
    "kind": "ours",
    "method": "Inversion",
    "sources": [],
    "step": "plugs",
    "mechanism": "The router does not fix a free plug before the search. The search starts from the whole free side at once, so the first leg goes straight to the first corner. The plug is the foot of that leg.",
    "math": "Multi-source A*. For each corner c in the strip in front of the free side S, a start link has the cost dist(c, S) + λ · angle(c - foot(c), normal), with foot(c) the projection of c on S, clamped to the inset.",
    "cost": "O(k) more start links for each end, with k corners in the strip. Near T_c: 30 ms at 100 nodes, 1 s at 1 000 nodes.",
    "params": [
      "inset: 2 to 20, default 6",
      "λ (angle weight): 0 to 4, default 1",
      "minGap between two plugs of a side: 4 to 16, default 8"
    ],
    "wins": [
      "R3",
      "R4",
      "R10"
    ],
    "risks": [
      "R11",
      "R1"
    ],
    "placementDependent": true,
    "screen": "A scratch run of this note gives the first data: a pure slide of the plug straightens 9% to 13% of the bent ends. Keep the full form when the median of R3 drops by 15% or more on small-clustered and case-dense-groups, with the minimum of R11 at 0.5 or more.",
    "prototype": "M",
    "stage": "cataloged",
    "related": [
      "WILD-002",
      "WILD-003",
      "WILD-006",
      "EDA-022"
    ],
    "wave": 1
  },
  {
    "id": "WILD-002",
    "family": "wild",
    "name": "Plug justification",
    "kind": "ours",
    "method": "Analogy: typography (justification and kerning)",
    "sources": [
      {
        "title": "An empirical distribution function for sampling with incomplete information",
        "authors": "Ayer, Brunk, Ewing, Reid and Silverman",
        "year": 1955,
        "url": "https://doi.org/10.1214/aoms/1177728423"
      },
      {
        "title": "Breaking paragraphs into lines",
        "authors": "Knuth and Plass",
        "year": 1981,
        "url": "https://doi.org/10.1002/spe.4380111102"
      }
    ],
    "step": "plugs",
    "mechanism": "Each plug of a side has an ideal place, where its route wants to leave. The plugs keep their order and a gap of at least s_min. The plugs move the least distance from their ideal places.",
    "math": "Minimize Σ (x_i - a_i)^2 with x_(i+1) - x_i ≥ s_min and lo ≤ x_i ≤ hi. Put y_i = x_i - i · s_min: the problem is isotonic regression of a_i - i · s_min. Pool adjacent violators solves it in O(k), then clamp to the side.",
    "cost": "O(k log k) for each side with the sort, O(m log m) in total. Less than 1 ms at 100 nodes and 5 ms at 1 000 nodes.",
    "params": [
      "s_min: 2 to 16, default 6",
      "ideal place: the straight line to the other end, or the first leg of the route",
      "weight of each plug: 1, or the count of its edges"
    ],
    "wins": [
      "R11",
      "R1",
      "R10"
    ],
    "risks": [
      "R10",
      "R3"
    ],
    "placementDependent": true,
    "screen": "On grid-400 and small-clustered, the minimum of R11 must reach 1.0 on each side with room for its plugs. Drop it when R1 grows by more than 2%.",
    "prototype": "S",
    "stage": "cataloged",
    "related": [
      "WILD-001",
      "WILD-003",
      "WILD-004",
      "NAT-031",
      "EDA-022",
      "NAT-032"
    ],
    "same": [
      "NAT-031"
    ],
    "wave": 1
  },
  {
    "id": "WILD-003",
    "family": "wild",
    "name": "Plug auction",
    "kind": "ours",
    "method": "Analogy: auctions and markets",
    "sources": [
      {
        "title": "The auction algorithm: a distributed relaxation method for the assignment problem",
        "authors": "Bertsekas",
        "year": 1988,
        "url": "https://doi.org/10.1007/BF02186476"
      }
    ],
    "step": "plugs",
    "mechanism": "Each side has slots at an even spacing. Each end of an edge bids for the slots of its box. The auction gives each end one slot at the lowest total cost, and no two ends share a slot.",
    "math": "Assignment problem with c(end, slot) = w_a · angle(slot → other end, normal) + w_d · detour estimate + w_x · crossings of the straight stubs. The auction of Bertsekas with ε-scaling: a bidder raises the price of its best slot by best - second + ε.",
    "cost": "O(s · k · log(C / ε)) for each box with k ends and s slots. Less than 2 ms at 100 nodes and 20 ms at 1 000 nodes.",
    "params": [
      "slots on each side: 2 to 16, or side / s_min",
      "w_a, w_d, w_x: 0 to 4",
      "ε: 0.01 to 1"
    ],
    "wins": [
      "R10",
      "R11",
      "R1",
      "R3"
    ],
    "risks": [
      "R5",
      "R6"
    ],
    "placementDependent": true,
    "screen": "On case-dense-groups and small-clustered, keep it when R1 drops by 5% or more and the minimum of R11 is 1.0, with the q95 of R5 up by less than 3%.",
    "prototype": "M",
    "stage": "cataloged",
    "related": [
      "WILD-002",
      "WILD-004",
      "WILD-024",
      "EDA-022"
    ],
    "wave": 4
  },
  {
    "id": "WILD-004",
    "family": "wild",
    "name": "Side spill by capacity",
    "kind": "ours",
    "method": "Analogy: compilers (register allocation and spills)",
    "sources": [
      {
        "title": "Register allocation and spilling via graph coloring",
        "authors": "Chaitin",
        "year": 1982,
        "url": "https://doi.org/10.1145/800230.806984"
      }
    ],
    "step": "plugs",
    "mechanism": "A side holds at most cap plugs at the spacing s_min. When more ends face that side, the ends with the lowest cost to move spill to the next side. A register allocator spills values in the same way.",
    "math": "cap_s = floor(len_s / s_min) - 1. Sort the ends of a full side by the spill cost: the gain of angle to the next side, clockwise or counter-clockwise. Move the cheapest ends until the side fits. Do at most 4 passes around the box.",
    "cost": "O(k log k) for each box. Less than 1 ms at 100 and at 1 000 nodes.",
    "params": [
      "s_min: 2 to 16, default 6",
      "spill to: the nearer side, or both sides",
      "passes: 1 to 4"
    ],
    "wins": [
      "R11",
      "R12"
    ],
    "risks": [
      "R10",
      "R3"
    ],
    "placementDependent": true,
    "screen": "On mid-fanout (in CI) and a case board with a fan of 20 edges, count the sides with R11 below 1. Keep it when that count drops to 0 and the mean of R10 rises by less than 10°.",
    "prototype": "S",
    "stage": "cataloged",
    "related": [
      "WILD-002",
      "WILD-003",
      "EDA-022"
    ],
    "wave": 4
  },
  {
    "id": "WILD-005",
    "family": "wild",
    "name": "Angular cohorts share a plug",
    "kind": "hybrid",
    "method": "Morphological box",
    "sources": [
      {
        "title": "Ckmeans.1d.dp: optimal k-means clustering in one dimension by dynamic programming",
        "authors": "Wang and Song",
        "year": 2011,
        "url": "https://journal.r-project.org/archive/2011-2/RJournal_2011-2_Wang+Song.pdf"
      }
    ],
    "step": "plugs",
    "mechanism": "The ends of a box are sorted by the angle toward their other ends. Breaks in the angle split them into cohorts. Each cohort shares one plug and one short stub, then fans out.",
    "math": "Optimal 1D clustering of the angles by dynamic programming: minimize Σ variance within each cohort + β · cohorts. A cohort has 2 or more ends and a spread of θ_max or less.",
    "cost": "O(k^2) for each box with k ends. Less than 2 ms at 100 nodes and 20 ms at 1 000 nodes.",
    "params": [
      "θ_max: 5° to 45°, default 20°",
      "β: 0 to 10",
      "smallest cohort: 2 to 5"
    ],
    "wins": [
      "B1",
      "R11",
      "B7"
    ],
    "risks": [
      "B4",
      "B6"
    ],
    "placementDependent": true,
    "screen": "On mid-fanout (in CI) and small-clustered, keep it when B1 rises by 0.05 or more and B4 rises by less than 0.02.",
    "prototype": "S",
    "stage": "cataloged",
    "related": [
      "WILD-030",
      "WILD-036",
      "HWY-015"
    ],
    "same": [
      "HWY-015"
    ],
    "canonical": "HWY-015",
    "wave": 2
  },
  {
    "id": "WILD-006",
    "family": "wild",
    "name": "Eight-direction plugs",
    "kind": "ours",
    "method": "Morphological box",
    "sources": [],
    "step": "plugs",
    "mechanism": "A box also gets four corner plugs with diagonal normals. An edge whose direction is near 45° leaves from a corner, so its first leg needs no turn.",
    "math": "The set of normals is the 4 side normals and the 4 diagonals. Pick the normal nearest to the direction of the other end. A corner plug sits at the corner, moved in by inset along both sides. Its out point is p + margin · n.",
    "cost": "O(1) for each end, as today.",
    "params": [
      "corner plugs: on or off",
      "diagonal window: 10° to 40°, default 22.5°",
      "inset: 2 to 12"
    ],
    "wins": [
      "R10",
      "R3",
      "R4"
    ],
    "risks": [
      "R11",
      "R8",
      "R14"
    ],
    "placementDependent": true,
    "screen": "On grid-400 and small-clustered, keep it when the mean of R4 drops by 10% or more and the tight share of R8 does not rise.",
    "prototype": "M",
    "stage": "cataloged",
    "related": [
      "WILD-001"
    ],
    "wave": 4
  },
  {
    "id": "WILD-007",
    "family": "wild",
    "name": "Groups from routes",
    "kind": "ours",
    "method": "Inversion",
    "sources": [],
    "step": "group",
    "mechanism": "The router routes each edge with corners first. Two nodes whose routes use the same corridors are similar. A merge on the graph of neighbours joins similar nodes, so each group holds nodes whose edges travel together.",
    "math": "Put each route on cells of side 4u. The vector of a node is the count of each cell that its routes touch, with TF-IDF weights. The similarity is the cosine. Average linkage merges only Delaunay neighbours. Cut the merge tree at the ratio r.",